Symbol,Name,Last Sale,Net Change,% Change,Market Cap,Country,IPO Year,Volume,Sector,Industry
MDWD,MediWound Ltd. Ordinary Shares,$10.95,0.10,0.922%,100787151.00,Israel,2014,4920,Health Care, Medicinal Chemicals and Botanical Products 
MDXG,MiMedx Group Inc Common Stock,$5.775,0.245,4.43%,658829879.00,United States,,1023582,Health Care,Biotechnology: Pharmaceutical Preparations
ME,23andMe Holding Co. Class A Common Stock,$2.105,0.085,4.208%,962509457.00,United States,,1146827,Health Care,Precision Instruments
MEDP,Medpace Holdings Inc. Common Stock,$207.625,2.435,1.187%,6332370239.00,United States,2016,177324,Health Care,Biotechnology: Commercial Physical & Biological Resarch
MEIP,MEI Pharma Inc. Common Stock,$6.4371,0.0621,0.974%,42890674.00,United States,2003,51244,Health Care,Biotechnology: Pharmaceutical Preparations
MESO,Mesoblast Limited American Depositary Shares,$3.35,0.03,0.904%,493507471.00,Australia,2015,38100,Health Care,Biotechnology: Biological Products (No Diagnostic Substances)
MGNX,MacroGenics Inc. Common Stock,$7.12,-0.02,-0.28%,440290583.00,United States,2013,178531,Health Care,Biotechnology: Pharmaceutical Preparations
MGTA,Magenta Therapeutics Inc. Common Stock,$0.7126,0.0326,4.794%,43211999.00,United States,2018,990597,Health Care,Biotechnology: Pharmaceutical Preparations
MGTX,MeiraGTx Holdings plc Ordinary Shares,$6.14,-0.16,-2.54%,298810855.00,United States,2018,132482,Health Care,Biotechnology: Biological Products (No Diagnostic Substances)
MHUA,Meihua International Medical Technologies Co. Ltd. Ordinary Shares,$3.10,-0.44,-12.429%,74214000.00,China,2022,41005,Health Care,Medical Specialities
MIRM,Mirum Pharmaceuticals Inc. Common Stock,$26.34,-1.51,-5.422%,999628497.00,United States,2019,399204,Health Care,Biotechnology: Pharmaceutical Preparations
MIRO,Miromatrix Medical Inc. Common Stock,$1.1202,-0.0298,-2.591%,30506701.00,United States,2021,10005,Health Care,Biotechnology: Biological Products (No Diagnostic Substances)
MIST,Milestone Pharmaceuticals Inc. Common Shares,$3.56,-0.04,-1.111%,118502525.00,Canada,2019,126000,Health Care,Pharmaceuticals and Biotechnology
MLSS,Milestone Scientific Inc. Common Stock,$0.75,-0.0001,-0.013%,52498894.00,United States,2015,29264,Health Care,Industrial Specialties
MLTX,MoonLake Immunotherapeutics Class A Ordinary Shares,$26.72,2.16,8.795%,1408173686.00,United States,2020,377760,Health Care,Biotechnology: Pharmaceutical Preparations
MLYS,Mineralys Therapeutics Inc. Common Stock,$15.7458,1.0958,7.48%,643320687.00,United States,2023,85157,Health Care,Biotechnology: Pharmaceutical Preparations
MMSI,Merit Medical Systems Inc. Common Stock,$84.85,1.51,1.812%,4873793843.00,United States,,108868,Health Care,Medical/Dental Instruments
MNK,Mallinckrodt plc Ordinary Shares,$5.10,-0.33,-6.077%,67171753.00,,2022,26394,Health Care,Pharmaceuticals and Biotechnology
MNKD,MannKind Corporation Common Stock,$3.99,0.10,2.571%,1054352967.00,United States,2004,1967366,Health Care,Biotechnology: Pharmaceutical Preparations
MNMD,Mind Medicine (MindMed) Inc. Common Shares,$3.375,-0.245,-6.768%,128463924.00,Canada,,549006,Health Care,Biotechnology: Pharmaceutical Preparations
MNOV,Medicinova Inc Common Stock,$2.17,0.05,2.358%,106430354.00,United States,,46125,Health Care,Biotechnology: Pharmaceutical Preparations
MNPR,Monopar Therapeutics Inc. Common Stock,$0.9857,0.0157,1.619%,10582866.00,United States,2019,10240,Health Care,Biotechnology: Pharmaceutical Preparations
MODD,Modular Medical Inc. Common Stock,$1.77,0.00,0.00%,19349813.00,United States,,1650,Health Care,Industrial Specialties
MOR,MorphoSys AG American Depositary Shares,$5.65,0.09,1.619%,772150764.00,Germany,2018,653453,Health Care,Biotechnology: Pharmaceutical Preparations
MORF,Morphic Holding Inc. Common Stock,$54.91,2.10,3.977%,2179485524.00,United States,2019,596298,Health Care,Biotechnology: Pharmaceutical Preparations
MOTS,Motus GI Holdings Inc. Common Stock,$0.7798,-0.0115,-1.453%,3726565.00,Israel,2018,14020,Health Care,Biotechnology: Electromedical & Electrotherapeutic Apparatus
MOVE,Movano Inc. Common Stock,$1.09,0.02,1.869%,45028018.00,United States,2021,3713,Health Care,Biotechnology: Electromedical & Electrotherapeutic Apparatus
MRAI,Marpai Inc. Class A Common Stock,$0.6423,0.0098,1.549%,18634706.00,United States,2021,111908,Health Care,Managed Health Care
MREO,Mereo BioPharma Group plc American Depositary Shares,$1.24,-0.02,-1.587%,154982272.00,United Kingdom,,1791311,Health Care,Biotechnology: Pharmaceutical Preparations
MRKR,Marker Therapeutics Inc. Common Stock,$1.4099,-0.1101,-7.243%,12405469.00,United States,,193159,Health Care,Biotechnology: Pharmaceutical Preparations
MRNS,Marinus Pharmaceuticals Inc. Common Stock,$8.98,0.09,1.012%,445992751.00,United States,2014,527631,Health Care,Biotechnology: Pharmaceutical Preparations
MRSN,Mersana Therapeutics Inc. Common Stock,$7.1875,0.1475,2.095%,776437407.00,United States,2017,3023804,Health Care,Biotechnology: Pharmaceutical Preparations
MRTX,Mirati Therapeutics Inc. Common Stock,$45.92,0.91,2.022%,2667556032.00,United States,,527445,Health Care,Biotechnology: Pharmaceutical Preparations
MRUS,Merus N.V. Common Shares,$21.125,2.315,12.307%,978452561.00,Netherlands,2016,480794,Health Care,Biotechnology: Pharmaceutical Preparations
MRVI,Maravai LifeSciences Holdings Inc. Class A Common Stock,$14.53,1.19,8.921%,1914890436.00,United States,2020,4342359,Health Care,Biotechnology: Pharmaceutical Preparations
MTEM,Molecular Templates Inc. Common Stock,$0.4301,0.0101,2.405%,24236843.00,United States,2005,100474,Health Care,Biotechnology: Biological Products (No Diagnostic Substances)
MTEX,Mannatech Incorporated Common Stock,$13.00,0.00,0.00%,24356904.00,United States,,39,Health Care, Medicinal Chemicals and Botanical Products 
MTNB,Matinas Biopharma Holdings Inc. Common Stock,$0.6086,-0.0014,-0.23%,132227191.00,United States,2017,162894,Health Care,Biotechnology: Pharmaceutical Preparations
MXCT,MaxCyte Inc. Common Stock,$4.775,0.045,0.951%,491370157.00,United States,2021,199070,Health Care,Biotechnology: Electromedical & Electrotherapeutic Apparatus
MYGN,Myriad Genetics Inc. Common Stock,$19.20,-1.89,-8.962%,1565732909.00,United States,1995,764103,Health Care,Biotechnology: In Vitro & In Vivo Diagnostic Substances
MYMD,MyMD Pharmaceuticals Inc. Common Stock,$1.68,-0.045,-2.609%,66309615.00,United States,2014,652799,Health Care,Biotechnology: In Vitro & In Vivo Diagnostic Substances
MYNZ,Mainz Biomed N.V. Ordinary Shares,$5.17,0.30,6.16%,76653584.00,Germany,2021,84109,Health Care,Biotechnology: Pharmaceutical Preparations
MYO,Myomo Inc. Common Stock,$0.51,-0.0198,-3.737%,10670073.00,United States,2017,128670,Health Care,Industrial Specialties
NAMS,NewAmsterdam Pharma Company N.V. Ordinary Shares,$14.025,0.075,0.538%,1146793563.00,Netherlands,,13915,Health Care,Biotechnology: Pharmaceutical Preparations
NAMSW,NewAmsterdam Pharma Company N.V. Warrant,$2.54,0.10,4.098%,0.00,Netherlands,,8905,Health Care,Biotechnology: Pharmaceutical Preparations
NAOV,NanoVibronix Inc. Common Stock,$3.8799,0.1978,5.372%,6449857.00,United States,,3654,Health Care,Industrial Specialties
NARI,Inari Medical Inc. Common Stock,$63.97,1.27,2.026%,3554284956.00,United States,2020,626202,Health Care,Biotechnology: Electromedical & Electrotherapeutic Apparatus
NAUT,Nautilus Biotechnolgy Inc. Common Stock,$2.40,0.10,4.348%,299679341.00,United States,2020,16894,Health Care,Biotechnology: Pharmaceutical Preparations
NAVB,Navidea Biopharmaceuticals Inc. Common Stock,$0.1747,-0.0053,-2.944%,5739114.00,United States,,137807,Health Care,Biotechnology: In Vitro & In Vivo Diagnostic Substances
NBIX,Neurocrine Biosciences Inc. Common Stock,$97.74,1.90,1.982%,9532156249.00,United States,1996,462264,Health Care,Biotechnology: Biological Products (No Diagnostic Substances)
NBRV,Nabriva Therapeutics plc Ordinary Shares Ireland,$1.72,0.04,2.381%,5506504.00,Ireland,2015,10453,Health Care,Biotechnology: Pharmaceutical Preparations
NBSE,NeuBase Therapeutics Inc.  Common Stock,$0.1797,0.0076,4.416%,5958017.00,United States,,853737,Health Care,Biotechnology: Pharmaceutical Preparations
NBTX,Nanobiotix S.A. American Depositary Shares,$6.80,4.7699,234.959%,237005527.00,France,2020,38831007,Health Care,Biotechnology: Pharmaceutical Preparations
NBY,NovaBay Pharmaceuticals Inc. Common Stock,$0.98,-0.02,-2.00%,1994735.00,United States,2007,98566,Health Care,Biotechnology: Pharmaceutical Preparations
NCNA,NuCana plc American Depositary Share,$0.6954,-0.0126,-1.78%,36420106.00,United Kingdom,2017,63815,Health Care,Biotechnology: Pharmaceutical Preparations
NDRA,ENDRA Life Sciences Inc. Common Stock,$1.76,0.01,0.571%,5577621.00,United States,2017,103892,Health Care,Medical Specialities
NEO,NeoGenomics Inc. Common Stock,$15.21,0.76,5.26%,1940106835.00,United States,,711974,Health Care,Precision Instruments
NEOG,Neogen Corporation Common Stock,$17.44,0.03,0.172%,3770891118.00,United States,1989,727630,Health Care,Biotechnology: In Vitro & In Vivo Diagnostic Substances
NEPH,Nephros Inc. Common Stock,$1.44,0.00,0.00%,15098302.00,United States,,205,Health Care,Medical/Dental Instruments
NEPT,Neptune Wellness Solutions Inc. Ordinary Shares,$0.58,0.0122,2.149%,6957877.00,Canada,,20699,Health Care,Biotechnology: Pharmaceutical Preparations
NERV,Minerva Neurosciences Inc Common Stock,$5.80,1.19,25.813%,30973119.00,United States,2014,1034721,Health Care,Biotechnology: Pharmaceutical Preparations
NEXI,NexImmune Inc. Common Stock,$0.3385,0.0136,4.186%,8827556.00,United States,2021,13085,Health Care,Biotechnology: Pharmaceutical Preparations
NGM,NGM Biopharmaceuticals Inc. Common Stock,$4.065,0.125,3.173%,333559668.00,United States,2019,164879,Health Care,Biotechnology: Biological Products (No Diagnostic Substances)
NH,NantHealth Inc. Common Stock,$2.87,0.47,19.583%,22108482.00,United States,2016,628116,Health Care,Managed Health Care
NHC,National HealthCare Corporation Common Stock,$56.83,1.08,1.937%,872646757.00,United States,1986,37592,Health Care,Hospital/Nursing Management
NHWK,NightHawk Biosciences Inc. Common Stock,$0.6837,-0.0378,-5.239%,17809844.00,United States,2022,64880,Health Care,Biotechnology: Pharmaceutical Preparations
NKTR,Nektar Therapeutics  Common Stock,$0.82,0.0277,3.496%,155172814.00,United States,,998635,Health Care,Biotechnology: Pharmaceutical Preparations
NKTX,Nkarta Inc. Common Stock,$4.655,-0.075,-1.586%,227779991.00,United States,2020,222925,Health Care,Biotechnology: Pharmaceutical Preparations
NLSP,NLS Pharmaceutics Ltd. Ordinary Shares,$1.3312,0.0606,4.769%,47486274.00,Switzerland,2021,29707,Health Care,Biotechnology: Pharmaceutical Preparations
NLSPW,NLS Pharmaceutics Ltd. Warrant,$0.17,0.0345,25.461%,0.00,Switzerland,2021,2028,Health Care,Biotechnology: Pharmaceutical Preparations
NLTX,Neoleukin Therapeutics Inc. Common Stock,$0.8897,0.0007,0.079%,38095482.00,Canada,2014,89835,Health Care,Biotechnology: Pharmaceutical Preparations
NMRD,Nemaura Medical Inc. Common Stock,$0.7302,-0.0298,-3.921%,16716983.00,United Kingdom,,11258,Health Care,Medical Specialities
NMTC,NeuroOne Medical Technologies Corporation Common Stock,$1.42,0.07,5.185%,23236803.00,United States,,130074,Health Care,Medical Specialities
NMTR,9 Meters Biopharma Inc. Common Stock,$0.8299,0.1319,18.897%,11897742.00,United States,2018,165698,Health Care,Biotechnology: Pharmaceutical Preparations
NNOX,NANO-X IMAGING LTD Ordinary Shares,$15.55,1.15,7.986%,856715385.00,Israel,2020,5143052,Health Care,Medical Electronics
NNVC,NanoViricides Inc. Common Stock,$1.2245,-0.0055,-0.447%,14247058.00,United States,,25003,Health Care,Biotechnology: Pharmaceutical Preparations
NOTV,Inotiv Inc. Common Stock,$5.85,0.22,3.908%,149942731.00,United States,,209594,Health Care,Biotechnology: Pharmaceutical Preparations
NOVN,Novan Inc. Common Stock,$1.1749,0.0449,3.973%,32915259.00,United States,2016,118021,Health Care,Biotechnology: Pharmaceutical Preparations
NPCE,Neuropace Inc. Common Stock,$5.05,0.06,1.202%,126750208.00,United States,2021,61905,Health Care,Medical Specialities
NRBO,NeuroBo Pharmaceuticals Inc. Common Stock,$0.5802,-0.0198,-3.30%,14757978.00,United States,2016,218288,Health Care,Biotechnology: Pharmaceutical Preparations
NRC,National Research Corporation Common Stock (Delaware),$42.23,1.17,2.849%,1038850187.00,United States,,13610,Health Care,Managed Health Care
NRIX,Nurix Therapeutics Inc. Common stock,$9.735,0.295,3.125%,461880521.00,United States,2020,225093,Health Care,Biotechnology: Pharmaceutical Preparations
NRSN,NeuroSense Therapeutics Ltd. Ordinary Shares,$1.7322,-0.0078,-0.448%,20424306.00,Israel,2021,16518,Health Care,Biotechnology: Pharmaceutical Preparations
NRSNW,NeuroSense Therapeutics Ltd. Warrant,$0.4493,0.1393,44.935%,0.00,Israel,2021,7208,Health Care,Biotechnology: Pharmaceutical Preparations
NRXP,NRX Pharmaceuticals Inc. Common Stock,$0.6201,0.0201,3.35%,44372855.00,United States,2017,85063,Health Care,Biotechnology: Pharmaceutical Preparations
NRXPW,NRX Pharmaceuticals Inc. Warrant,$0.16,0.0099,6.596%,0.00,United States,2017,1113,Health Care,Biotechnology: Pharmaceutical Preparations
NSPR,InspireMD Inc. Common Stock,$1.3748,0.0448,3.368%,11447476.00,Israel,,42925,Health Care,Medical/Dental Instruments
NSTG,NanoString Technologies Inc. Common Stock,$9.03,-0.23,-2.484%,422522974.00,United States,2013,540634,Health Care,Biotechnology: Biological Products (No Diagnostic Substances)
NTLA,Intellia Therapeutics Inc. Common Stock,$44.04,0.39,0.893%,3876310034.00,United States,2016,1066054,Health Care,Biotechnology: In Vitro & In Vivo Diagnostic Substances
NTRA,Natera Inc. Common Stock,$54.06,1.13,2.135%,6179149253.00,United States,2015,718843,Health Care,Medical Specialities
NTRB,Nutriband Inc. Common Stock,$3.50,0.28,8.696%,27416029.00,United States,,19514,Health Care,Biotechnology: Pharmaceutical Preparations
NTRBW,Nutriband Inc. Warrant,$1.87,-0.02,-1.058%,0.00,United States,,1802,Health Care,Biotechnology: Pharmaceutical Preparations
NURO,NeuroMetrix Inc. Common Stock,$1.02,-0.04,-3.774%,7947369.00,United States,2004,74873,Health Care,Medical/Dental Instruments
NUS,Nu Skin Enterprises Inc. Common Stock,$38.869,0.469,1.221%,1939632909.00,United States,1996,124677,Health Care,Other Pharmaceuticals
NUVA,NuVasive Inc. Common Stock,$42.72,1.31,3.163%,2236318992.00,United States,2004,1695540,Health Care,Medical/Dental Instruments
NUVB,Nuvation Bio Inc. Class A Common Stock,$1.665,0.045,2.778%,364308197.00,United States,2020,181159,Health Care,Biotechnology: Pharmaceutical Preparations
NUVL,Nuvalent Inc. Class A Common Stock,$38.75,0.05,0.129%,2197309179.00,United States,2021,140983,Health Care,Biotechnology: Pharmaceutical Preparations
NUWE,Nuwellis Inc. Common Stock,$4.47,0.03,0.676%,5394986.00,United States,,14112,Health Care,Biotechnology: Electromedical & Electrotherapeutic Apparatus
NVACR,NorthView Acquisition Corporation Rights,$0.17,0.0149,9.607%,0.00,United States,2022,173,Health Care,Medical/Dental Instruments
NVAX,Novavax Inc. Common Stock,$7.72,0.15,1.982%,665257451.00,United States,,4620565,Health Care,Biotechnology: Biological Products (No Diagnostic Substances)
NVCR,NovoCure Limited Ordinary Shares,$68.195,1.455,2.18%,7241606455.00,Jersey,2015,583411,Health Care,Medical/Dental Instruments
NVCT,Nuvectis Pharma Inc. Common Stock,$15.0599,0.1699,1.141%,222169714.00,United States,2022,53982,Health Care, Medicinal Chemicals and Botanical Products 
NVIV,InVivo Therapeutics Holdings Corp Common Stock,$1.457,0.127,9.549%,4167670.00,United States,,85310,Health Care,Biotechnology: Biological Products (No Diagnostic Substances)
NVNO,enVVeno Medical Corporation Common Stock,$3.75,0.03,0.806%,35520000.00,United States,2018,12446,Health Care,Medical/Dental Instruments
NVNOW,enVVeno Medical Corporation Warrants,$0.0397,-0.0006,-1.489%,0.00,United States,2018,36908,Health Care,Medical/Dental Instruments
NVOS,Novo Integrated Sciences Inc. Common Stock,$0.1652,0.0072,4.557%,23831342.00,United States,,10158213,Health Care,Assisted Living Services
NVRO,Nevro Corp. Common Stock,$27.158,-0.202,-0.738%,969319208.00,United States,2014,218641,Health Care,Biotechnology: Electromedical & Electrotherapeutic Apparatus
NVST,Envista Holdings Corporation Common Stock,$35.42,0.36,1.027%,5797794178.00,,2019,1187671,Health Care,Medical/Dental Instruments
NVTA,Invitae Corporation Common Stock,$1.54,0.08,5.479%,399561254.00,United States,2015,6924093,Health Care,Medical Specialities
NXGL,NexGel Inc Common Stock,$1.60,0.00,0.00%,8978051.00,United States,2021,2267,Health Care,Medical/Dental Instruments
NXGLW,NexGel Inc Warrant,$0.1686,-0.0114,-6.333%,0.00,United States,2021,3612,Health Care,Medical/Dental Instruments
NXGN,NextGen Healthcare Inc. Common Stock,$16.75,0.13,0.782%,1105861063.00,United States,,134795,Health Care,Managed Health Care
NXL,Nexalin Technology Inc. Common Stock,$0.8399,-0.0301,-3.46%,6119983.00,United States,2022,2034,Health Care,Medical Specialities
NXLIW,Nexalin Technology Inc. Warrant,$0.0886,0.00,0.00%,0.00,United States,2022,200,Health Care,Medical Specialities
NXTC,NextCure Inc. Common Stock,$1.59,0.00,0.00%,44161512.00,United States,2019,63663,Health Care,Biotechnology: Pharmaceutical Preparations
NYMX,Nymox Pharmaceutical Corporation Common Stock (Bahamas),$0.4499,0.0299,7.119%,40722761.00,Canada,,18157,Health Care,Biotechnology: In Vitro & In Vivo Diagnostic Substances
NYXH,Nyxoah SA Ordinary Shares,$8.20,-0.06,-0.726%,235028277.00,Belgium,2021,42553,Health Care,Medical/Dental Instruments
OABI,OmniAb Inc. Common Stock,$3.625,0.185,5.378%,418993885.00,United States,2021,345147,Health Care,Biotechnology: Pharmaceutical Preparations
OBIO,Orchestra BioMed Holdings Inc. Ordinary Shares,$16.38,1.80,12.346%,517838614.00,United States,2020,11644,Health Care, Medicinal Chemicals and Botanical Products 
OCEA,Ocean Biomedical Inc. Common Stock,$6.38,0.11,1.754%,0.00,United States,2021,81673,Health Care,Biotechnology: Pharmaceutical Preparations
OCEAW,Ocean Biomediacal Inc. Warrants,$0.175,-0.0044,-2.453%,0.00,United States,2021,12708,Health Care,Biotechnology: Pharmaceutical Preparations
OCGN,Ocugen Inc. Common Stock,$0.7037,0.0087,1.252%,159336816.00,United States,2014,4516535,Health Care,Biotechnology: Pharmaceutical Preparations
OCS,Oculis Holding AG Ordinary shares,$12.55,0.13,1.047%,0.00,Switzerland,,4307,Health Care,Biotechnology: Pharmaceutical Preparations
OCSAW,Oculis Holding AG Warrants,$0.7226,-0.1474,-16.943%,0.00,Switzerland,,15595,Health Care,Biotechnology: Pharmaceutical Preparations
OCUL,Ocular Therapeutix Inc. Common Stock,$6.20,0.11,1.806%,480556631.00,United States,2014,697702,Health Care,Biotechnology: Pharmaceutical Preparations
OCUP,Ocuphire Pharma Inc. Common Stock,$6.20,0.34,5.802%,129876546.00,United States,,270656,Health Care,Biotechnology: Pharmaceutical Preparations
OCX,Oncocyte Corporation Common Stock,$0.262,-0.0062,-2.312%,31251051.00,United States,,205294,Health Care,Biotechnology: Pharmaceutical Preparations
OFIX,Orthofix Medical Inc. Common Stock (DE),$18.54,0.46,2.544%,675886157.00,Curacao,1992,177544,Health Care,Medical/Dental Instruments
OGEN,Oragenics Inc. Common Stock,$2.7262,0.0762,2.875%,5519620.00,United States,,5752,Health Care,Biotechnology: Pharmaceutical Preparations
OGI,Organigram Holdings Inc. Common Shares,$0.5133,0.0253,5.184%,161182232.00,Canada,,481968,Health Care,Biotechnology: Pharmaceutical Preparations
OGN,Organon & Co. Common Stock ,$22.395,0.385,1.749%,5696901283.00,,2021,1631688,Health Care,Biotechnology: Pharmaceutical Preparations
OKYO,OKYO Pharma Limited American Depositary Shares,$1.72,-0.03,-1.714%,37444147.00,Guernsey,2022,8048,Health Care,Biotechnology: Biological Products (No Diagnostic Substances)
OLMA,Olema Pharmaceuticals Inc. Common Stock,$6.635,0.285,4.488%,269591648.00,United States,2020,197567,Health Care,Biotechnology: Pharmaceutical Preparations
OM,Outset Medical Inc. Common Stock,$21.00,0.05,0.239%,1033529784.00,United States,2020,510303,Health Care,Biotechnology: Electromedical & Electrotherapeutic Apparatus
OMCL,Omnicell Inc. Common Stock ($0.001 par value),$65.90,0.66,1.012%,2970037874.00,United States,2001,313524,Health Care,Managed Health Care
OMER,Omeros Corporation Common Stock,$5.145,0.175,3.521%,323253996.00,United States,2009,200923,Health Care,Biotechnology: Pharmaceutical Preparations
OMGA,Omega Therapeutics Inc. Common Stock,$8.62,0.56,6.948%,474299027.00,United States,2021,39293,Health Care,Biotechnology: Pharmaceutical Preparations
OMI,Owens & Minor Inc. Common Stock,$18.975,5.425,40.037%,1445747242.00,United States,,2278505,Health Care,Medical Specialities
OMIC,Singular Genomics Systems Inc. Common Stock,$1.07,0.01,0.943%,77035684.00,United States,2021,99258,Health Care,Medical/Dental Instruments
ONCR,Oncorus Inc. Common Stock,$0.3299,-0.0291,-8.106%,8608860.00,United States,2020,50742,Health Care, Medicinal Chemicals and Botanical Products 
ONCS,OncoSec Medical Incorporated Common Stock,$0.8269,0.0019,0.23%,3765850.00,United States,,175381,Health Care,Biotechnology: In Vitro & In Vivo Diagnostic Substances
ONCT,Oncternal Therapeutics Inc. Common Stock,$0.3153,-0.0007,-0.222%,18511721.00,United States,2004,199142,Health Care,Biotechnology: Pharmaceutical Preparations
ONCY,Oncolytics Biotech Inc. Common Shares,$1.6099,0.1599,11.028%,101614067.00,Canada,,229706,Health Care,Biotechnology: Pharmaceutical Preparations
ONTX,Onconova Therapeutics Inc. Common Stock,$1.3701,0.0701,5.392%,28730393.00,United States,2013,79381,Health Care,Biotechnology: Pharmaceutical Preparations
ONVO,Organovo Holdings Inc. Common Stock,$1.92,-0.04,-2.041%,16732013.00,United States,,11913,Health Care,Biotechnology: Biological Products (No Diagnostic Substances)
OPCH,Option Care Health Inc. Common Stock,$28.01,0.51,1.855%,5034985559.00,United States,,8730136,Health Care,Medical/Nursing Services
OPGN,OpGen Inc. Common Stock,$0.79,0.055,7.483%,4341481.00,United States,2015,125479,Health Care,Medical Specialities
OPK,OPKO Health Inc. Common Stock,$1.845,0.155,9.172%,1425540748.00,United States,,3035403,Health Care,Biotechnology: In Vitro & In Vivo Diagnostic Substances
OPRX,OptimizeRx Corporation Common Stock,$14.41,0.01,0.069%,246412398.00,United States,,53566,Health Care,Managed Health Care
OPT,Opthea Limited American Depositary Shares,$3.66,0.06,1.667%,213615194.00,Australia,2020,4050,Health Care,Biotechnology: Pharmaceutical Preparations
OPTN,OptiNose Inc. Common Stock,$2.03,0.08,4.103%,226974448.00,United States,2017,171550,Health Care,Biotechnology: Pharmaceutical Preparations
ORGO,Organogenesis Holdings Inc. Class A Common Stock,$2.11,0.05,2.427%,276781782.00,United States,2016,710803,Health Care,Biotechnology: Pharmaceutical Preparations
ORGS,Orgenesis Inc. Common Stock,$1.04,0.03,2.97%,22978249.00,United States,,82914,Health Care,Biotechnology: Pharmaceutical Preparations
ORIC,Oric Pharmaceuticals Inc. Common Stock,$5.16,0.21,4.242%,232670669.00,United States,2020,90130,Health Care,Biotechnology: Pharmaceutical Preparations
ORMP,Oramed Pharmaceuticals Inc. Common Stock,$2.80,0.07,2.564%,111394676.00,Israel,,517581,Health Care,Biotechnology: Pharmaceutical Preparations
ORTX,Orchard Therapeutics plc American Depositary Shares,$4.835,0.025,0.52%,88956501.00,United Kingdom,2018,25040,Health Care,Biotechnology: Biological Products (No Diagnostic Substances)
OSA,ProSomnus Inc. Common Stock,$5.065,-0.035,-0.686%,81230596.00,United States,,1164,Health Care,Medical Specialities
OSUR,OraSure Technologies Inc. Common Stock,$7.00,0.13,1.892%,531402354.00,United States,,274193,Health Care,Medical/Dental Instruments
OTLK,Outlook Therapeutics Inc. Common Stock,$1.145,0.035,3.153%,293883479.00,United States,2016,380034,Health Care,Biotechnology: Biological Products (No Diagnostic Substances)
OVID,Ovid Therapeutics Inc. Common Stock,$3.64,-0.01,-0.274%,256589096.00,United States,2017,113148,Health Care,Biotechnology: Pharmaceutical Preparations
OWLT,Owlet Inc. Class A Common Stock,$0.3162,0.007,2.264%,37142730.00,,2020,152686,Health Care,Biotechnology: Electromedical & Electrotherapeutic Apparatus
PACB,Pacific Biosciences of California Inc. Common Stock,$12.2192,0.3192,2.682%,3052486722.00,United States,2010,2769805,Health Care,Biotechnology: Electromedical & Electrotherapeutic Apparatus
PALI,Palisade Bio Inc. Common Stock,$1.585,0.035,2.258%,26848596.00,United States,,102496,Health Care,Biotechnology: Pharmaceutical Preparations
PASG,Passage Bio Inc. Common Stock,$1.0225,-0.0175,-1.683%,55855791.00,United States,2020,236051,Health Care,Biotechnology: Pharmaceutical Preparations
PAVM,PAVmed Inc. Common Stock,$0.5101,-0.0248,-4.636%,50203937.00,United States,2016,382134,Health Care,Industrial Specialties
PAVMZ,PAVmed Inc. Series Z Warrant,$0.11,-0.0249,-18.458%,0.00,United States,,67513,Health Care,Industrial Specialties
PAVS,Paranovus Entertainment Technology Ltd. Class A Ordinary Shares,$3.69,-0.2399,-6.104%,25689522.00,China,2019,6479,Health Care, Medicinal Chemicals and Botanical Products 
PBH,Prestige Consumer Healthcare Inc. Common Stock,$60.54,-1.48,-2.386%,3008091421.00,United States,2005,147167,Health Care,Biotechnology: Pharmaceutical Preparations
PBLA,Panbela Therapeutics Inc. Common Stock,$0.44,-0.01,-2.222%,6422184.00,United States,,765076,Health Care,Biotechnology: Pharmaceutical Preparations
PBYI,Puma Biotechnology Inc Common Stock,$3.18,0.57,21.839%,148319191.00,United States,,675773,Health Care,Biotechnology: Pharmaceutical Preparations
PCRX,Pacira BioSciences Inc. Common Stock,$42.63,-0.51,-1.182%,1960341189.00,United States,2011,386409,Health Care,Biotechnology: Pharmaceutical Preparations
PCSA,Processa Pharmaceuticals Inc. Common Stock,$0.72,0.0599,9.074%,17681466.00,United States,,233432,Health Care,Biotechnology: Pharmaceutical Preparations
